{
  "schemaVersion": "1.0.0",
  "qualificationId": "volqual_gitea_example",
  "tenantScope": "tenant_demo",
  "hostId": "host_demo01",
  "observedAt": "2026-10-21T09:00:00Z",
  "expiresAt": "2026-10-21T09:30:00Z",
  "daemon": {
    "contextName": "default",
    "endpointKind": "unix",
    "serverVersion": "29.1.3",
    "rootDir": "/var/lib/docker"
  },
  "storage": {
    "managedVolumesCapable": true,
    "enforcementMethod": "preflight-only",
    "quotaEnforceable": false,
    "storageFreeMb": 434659,
    "filesystemType": "ext4"
  },
  "volumes": [
    { "name": "gitea-data", "purpose": "application-data" },
    { "name": "gitea-config", "purpose": "application-config" }
  ],
  "result": "not-qualified"
}
